Segment Number,Start Longitude,Start Latitude,End Longitude,End Latitude, Location, Landmarks,Landmark long, Landmark lat, Description_new,Distance (km),Part, imagesPath,Description
1,-118.478476,37.0577188,-120.5812901,42.04745979, Southern California Near the border of Mexico, Campo is the monument of the southern terminus,-116.46891,32.60645, This Paths of the trail is the most southern; here you go through dessert. It is important that you stay hydrated. During the day the temperature is high and at night it can be very cold. You walk on the side of Sheephead Mountain and Wooden Hill. You have some of the trail in Sawtooth Mountains wilderness where you can be able to see the caracteristic mountains.,84.8 km, Segment 1/50, Images/Segment1.jpg, This Paths of the trail is the most southern; here you go through dessert
2,-120.5812901,42.04745979,-121.0203383,42.55305601, Southern California and Anza-Borrego desert ,Anza-Borrego Desert the park was established in 1932. The park covers 237120 ha ,-116.3014,33.10154,You are in the very southern part and in summer this can be very hot. You go through Anza-Borrego Desert State park. Here You can see amazing flowers and plants that blooms ind spring. The Park was created in 1932 the park takes its name from 18th century Spanish explorer Juan Bautista de Anza and borrego is a Spanish word for sheep. The park is 237120 ha ,83.2 km, Segment 2/50, Images/Segment2.jpg,You are in the very southern part and in summer this can be very hot
3,-121.0203383,42.55305601,-121.1910008,42.37309226, Southern California through Warner Springs,Combs Peak is the highest point of the isolated Bucksnort Mountain mini-range in northern San Diego County.,-116.6058,33.394,You will pass through rugged desert terrain featuring occasional oases and challenging climbs in this segment. You go past Warner Springs which is set of springs and a small unincorporated community in northern San Diego County. On the trail you righ on the side of Combs peak. The Combs Peak area is typical San Diego County chaparral country with manzanita; scrub oak; buckthorn; red shanks and chamise densely clothing unburned areas of its mountain slopes. Recent fires swept through the eastern flanks and as a result have made the scramble and approach from the PCT much easier. ,83.2 km, Segment 3/50, Images/Segment3.jpg,You will pass through rugged desert terrain featuring occasional oases and challenging climbs in this segment
4,-121.1910008,42.37309226,-118.8414404,37.32590421, Southern California through Jacinto Wildernes, Suicide Rocks name comes from a story of a Native American princess and her lover who after being ordered to separate instead committed suicide by jumping off the rock,-116.697429,33.770965,You will walk through Jacinto Wildernes. You go close to Suicide Rock and take a trip to the top of it if you want to. Hiking the Suicide Rock Trail gives you the big mountain feel without climbing the big mountains. You'll have to hike uphill on the Deer Springs Trail - through the oaks that give way to pines as you get higher. The payoff is a massive slab of granite with views of the mountains surrounding you. You need a free permit to hike to Suicide Rock. ,83.2 km, Segment 4/50, Images/Segment4.jpg,You will walk through Jacinto Wildernes 
5,-118.8414404,37.32590421,-120.908273,46.04730289, Southern California and Sand to Snow National Monument,Sand to Snow National Monument protects diverse montane and desert habitats of the San Bernardino; Mountains southern Mojave Desert and northwestern Colorado Desert.,-116.4308,34.1132, You are walking with a weiuw to Sand to Snow National Monumant. Here you will see iconic sand red moutains and behind thoose white mountains with snow. You also go up on Onyx Peak which is a mountain pass located in the San Bernardino Mountains in the southwestern part of San Bernardino County. ,83.2 km, Segment 5/50, Images/Segment5.jpg, You need to cross Mission Creek several times
6,-120.908273,46.04730289,-117.7516927,34.12845803, Southern California through San Bernardino National Forest ,Big Bear Lake is Southern California's four-season mountain lake escape and one of the world's rare Sky Island Forests,-116.901,34.2318, You can see Big Bear Lake from this part of the trail. Big Bear Lake is the jewel of the San Bernardino National Forest: known for excellent fishing; snowboarding and skiing; hiking; mountain biking and so much more! You walk in San Bernardino National Forrest. Covering 3333.87 km2 and beeing divided into two large areas a norther and a southern portion. This site was the filming location for Daniel Boone in 1936; part of the 1969 musical film Paint Your Wagon was shot here. ,83.2 km, Segment 6/50, Images/Segment6.jpg,On this part of the Trail yo can see Mt Baden Powell who is the founder of scouts. The first groups of scouts were formed in 1907 on the basis og his book Aids for Scouting
7,-117.7516927,34.12845803,-121.5504511,44.57576911, Southern California and Sheep Mountain Wilderness, Vasquez Rocks,-118.19,34.2848,You will cross instate 15 and you will walk approximately 1436 meters in altitude in a long stretch. On the way you will se Table Mountain and Mount San Antonio. If you want close by is Vasquez Rock renowned for its striking and jagged rock formations. This is formed by rapid erosion over millions of years. This iconic landscape has been a popular filming location for various movies and TV shows. ,83.2 km, Segment 7/50, Images/Segment7.jpg,You walk on the egde of Big Bear City
8,-121.5504511,44.57576911,-120.9071109,39.35874634, Southern California in Angeles National Forests,Mount Baden Powell is the 4th highest peak in San Gabriel Range with 853 meters over the surrounding terrain.,-117.7646,34.3584,You go in Angeles National forests. The Angeles National Forest is an urban national forest in the center of an ever-changing population and provides a place for surrounding communities to experience solitude; quiet; and enjoy unique recreation opportunities. On this part of the Trail you will climb Mt Baden Powell who is the founder of scouts. The first groups of scouts were formed in 1907 on the basis og his book Aids for Scouting. Baden-Powell is one of the classic hikes in the San Gabriels that you must add to your peak-bagging bucket list.,83.2km, Segment 8/50, Images/Segment8.jpg,You go in Angeles National forests
9,-120.9071109,39.35874634,-121.7982932,45.88117289," Southern California ""Sweet Water""", Agua Dulce is a Spanish word that means Sweet Water.,-118.32,34.5,On this part of the route you walk in a mixture of hilly terrain and valleys of sand. You come through Agua Dulce on you way. Agua Dulce in California is a charming rural community known for its rolling hills and a serene country lifestyle. It features natural attractions like Vasquez Rocks which offer stunning landscapes and outdoor recreational opportunities. It covers a geographic area of about 59 square kilometers ,83.2 km, Segment 9/50, Images/Segment9.jpg,On this part of the route you walk in a mixture of hilly terrain and valleys of sand
10,-121.7982932,45.88117289,-120.9779288,39.8078156, Southern Californias Through Walker Pass ,Burnt Peak is the highest peak of the Sierra Pelona located in northwestern Los Angeles County,-118.5769,34.683,You are both  on the egde of moutains and have some of the trail in the city of Lancaster In this part you will meet Walkers Pass and Burnt Peak. Walker's Pass is a mountain pass in the Sierra Nevada offering panoramic views and a gateway to diverse hiking trails. Burnt Peak and Lake Hughes in California are noted for their scenic beauty. Burnt Peak with its 1781 meters hight providing expansive views of the surrounding landscapes and Lake Hughes offering tranquil waters ideal for leisure activities,83.2 km, Segment 10/50, Images/Segment10.jpg,You are both  on the egde of moutains and have some of the trail in the city of Lancaster
11,-120.9779288,39.8078156,-120.3586733,45.08212134, Sierra Nevada in California through Kennedy Meadow, Double Mountain is the highest point in the Tehachapi Mountains of California.,-118.4867,35.0333, This part of the trail is hilly and you will need to cross several small creeks. You will see Double Mountain has two summits of nearly the same elevation. It is south of the town of Tehachapi. You come close to the city Mojave which is a city in the dessert. The town of Mojave began in 1876 as a construction camp on the Southern Pacific Railroad. From 1884 to 1889 the town was the western terminus of the 266 km twenty-mule team at Harmony Borax Works in Death Valley. It later served as headquarters for construction of the Los Angeles Aqueduct.,83.2 km, Segment 11/50 , Images/Segment11.jpg, This part of the trail is hilly and you will need to cross several small creeks
12,-120.3586733,45.08212134,-121.7016886,42.68975638, Sierra Nevada in California & Oakley Ridge,Piute Peak mountain range located in the Eastern Mojave Desert and within Mojave Trails National Monument. it is 2573 meters high,-118.767,37.3681,As you hike this section of the Pacific Crest Trail you'll first ascend Welden Peak offering expansive views from the summit. The trail then winds between Piute Peak and Sorrell Peak showcasing diverse vegetation and geological features. Continuing on you'll skirt the edge of Pinyon Mountain where alpine landscapes blend with dense pinyon pine forests. This slightly challenging section provides a unique,83.2 km, Segment 12/50, Images/Segment12.jpg, You will both walk in hilly terran and forretes
13,-121.7016886,42.68975638,-118.1548683,35.14989535, Sierra Nevada in California through Kiawah Wildernes, Kiawah Wilderness is renowned for its natural beauty and abundant wildlife,,, As you hike this section of the Pacific Crest Trail you begin by ascending Weldon Peak and continue through a corridor nestled between Piute Peak and Sorrell Peak. The trail then skirts the edge of Pinyon Mountain leading you to the distinctive jagged summit of Sawtooth Peak. This path traverses through three wilderness areas: Owens Peak Wilderness; Kiavah Wilderness and Domeland Wilderness. Each offers unique landscapes and ecosystems from rugged mountainous terrains to intricate rock formations and expansive forested areas. These protected regions are rich in biodiversity and provide a pristine untouched environment making every step a chance for a unique and memorable experience in the heart of nature.,83.2 km, Segment 13/50 , Images/Segment13.jpg, You walk in both Owen Peak Wilderness; Kiavah Wildernes and Domeland Wildernes. A part with a lot of protected nature; so in this path the chance for uniqe experince
14,-118.1548683,35.14989535,-121.2857281,42.2562489,Sierra Nevada in  California through South Sierra Wilderness,Olancha Peak rises 3698 meter above the sealevel,-118.0705,36.1555,TThis section of the Pacific Crest Trail offers an immersive experience through the South Sierra Wilderness. You're surrounded by dramatic peaks including Rockhouse Peak Ball Mountain Bald Mountain and Olancha Peak creating a spectacular panorama of rugged landscapes. The trail winds through diverse terrains with each peak providing a unique backdrop. The area is known for its remote beauty and solitude allowing for profound connections with nature. You are enveloped by towering mountains and serene wilderness creating a majestic hiking experience.,83.2 km, Segment 14/50, Images/Segment14.jpg, You will be climbing many meters both up and down. You will be walking through the South Sierra Wilderness and there will be several mountain peaks and peaks around you along the way
15,-121.2857281,42.2562489,-121.3174455,42.14187776, Sierra Nevada in California and Alabama Hills, Mount Clarens King raises 3922 meter and 350 from the surrounding terrain,-118.4465,36.8336,The path carves through a breathtaking landscape dominated by some of the highest peaks in the Sierra Nevada. Starting from the north you encounter Mount Stanford and Mount Williamson which stand as towering sentinels over the trail offering challenging climbs and rewarding views. The trail continues to wind its way south leading you to the iconic Mount Whitney. The trail descends slightly towards Mount Langley and Cirque Peak.This offering a somewhat gentler terrain before it culminates near Muah Mountain.,83.2 km, Segment 15/50, Images/Segment15.jpg, You are walking in an area with many mountains. Some of the ones you can see on the trip are: Mount Withney; Mount Langley; Kern Peak; Cirque Peak
16,-121.3174455,42.14187776,-120.0047009,40.98451283, Sierra Nevada in California,Mount Whitney is the highest summit in the contiguous United States which provides a spectacular highlight,-118.1731,36.3443, You are in the middel of Inyo National Forrest. Inyo National Forest extends approximately 265 kilometers near the California and Nevada border. It covers about 809.371 hectares mostly on the eastern slope of the Sierra Nevada. You come inbetween Mount Clarience King; Acrodectes Peak; Mount Goddard and Mount Darwin. Mount Darwin is a flat-topped mountain (4218 meters high) in the Sierra Nevada on the border of between Fresno and Inyo counties in Kings Canyon National Park and the John Muir Wilderness of California. ,83.2 km, Segment 16/50, Images/Segment16.jpg, You are in the middel of Inyo National Forrest. Inyo National Forest extends approximately 265 kilometers near the California and Nevada border. It covers about 809.371 hectares mostly on the eastern slope of the Sierra Nevada
17,-120.0047009,40.98451283,-119.3990414,42.26149933, Sierra Nevada in  California and Mammoth Lakes,Bear Creek Spire is the 46th highest mountain in California and is 4184 meter above sealevel,-118.767,37.3681, In this segment of the Pacific Crest Trail you navigate a diverse Sierra Nevada landscape with dramatic altitude changes around peaks like Bloody Mountain Red Slate Mountain Mount Morgan Bear Creek Spire and Seven Gables. You'll encounter various lakes near Silver Peak and Mammoth Lakes offering serene vistas and tranquil surroundings. The trail combines high peaks and water bodies creating a dynamic and challenging hiking experience with opportunities for photography wildlife observation and solitude. ,83.2 km, Segment 17/50, Images/Segment17.jpg, You are walking in an area with many mountains and you encounter many altitude differences at the same time there are many larger and smaller lakes
18,-119.3990414,42.26149933,-119.0765253,37.09358935, California & Yosemita Natianal Park ,Mount Ritter is 4008 meter above sealevel and was named by Josiah Whitney chief of California geological survey ,-119.1999,37.6895,Traverse the Ansel Adams Wilderness and Yosemite National Park blending rugged terrain with iconic beauty. Begin in the Ansel Adams Wilderness named after the famed photographer and explore pristine alpine scenery with peaks like Mount Ritter and Mount Lyell. Experience seclusion and untouched nature before entering Yosemite National Park known for its biodiversity and geological wonders. Enjoy stunning waterfalls -  deep valleys -  grand meadows and ancient sequoias. Key landmarks include Mount Dana and Clouds Rest offering expansive views. This journey connects you with nature and offers a historical perspective encapsulating the essence of American wilderness and conservation.,83.2 km, Segment 18/50, Images/Segment18.jpg, You walk in both Ansel Adams Wildernes and the great Yosemite National Park. It was first protected in 1864.Yosemite National Park is best known for its waterfalls but you can find deep valleys and grand meadows as well
19,-119.0765253,37.09358935,-120.5819857,46.36160795, California & Hoover Wilderness ,Tower Peak is 3583 meter above sealevel and it is to the south of the summit is Yosemite National Park,-119.3252,38.084,You walk through the northern expanse of Yosemite Wilderness and into the Hoover Wilderness. The trail takes hikers through lush forests and challenging terrain with steep inclines and rugged paths. It winds through dense woodlands with towering trees and cool shade interspersed with clearings and views of distant peaks like Tower Peak. This part of the trail offers a deep backcountry experience with a physically demanding journey rewarding hikers with solitude tranquility and diverse wildlife encounters. The varying elevation provides exhilarating climbs and descents adding adventure and scenic variety ,83.2 km, Segment 19/50, Images/Segment19.jpg, As the trail moves northward; it traverses the lush forests of Northern California; with a mix of steep inclines and dense woodland
20,-120.5819857,46.36160795,-121.6728243,41.25952485,  California through Carson-Iceberg Wilderness ,Sonora Peak is located on the boundary between Alpine and Mono counties it is 3494 meters above sealevel,-119.6355,38.3538, This path navigates through an impressive section of the Sierra Nevada marked by the Carson-Iceberg Wilderness and notable peaks such as Highland Peak Whitecliff Peak Sonora Peak and Leavitt Peak. This stretch features rugged terrain dramatic elevations and the stark beauty of the Sierra's eastern slope. The trail leads through the Carson-Iceberg Wilderness known for its rocky landscapes glacial ice remnants geological formations dense conifer forests and various waterways. Key points include Sonora Peak and Leavitt Peak offering challenging hikes and breathtaking summit views. These peaks are popular for high-altitude trekking in less trafficked parts of the Sierra Nevada. ,83.2 km, Segment 20/50, Images/Segment20.jpg, During this par of the trail You'll cross the border between California and Oregon
21,-121.6728243,41.25952485,-117.2147623,33.88942411, Northern California  and Lake Tahoe,Pyramid Peak is 787 meter above the surrounding terrain ,-120.158,38.8443, The trail around Lake Tahoe offers a captivating journey through majestic landscapes including parts of the Lake Tahoe Basin Management Unit. It ascends towards Ralston Peak and Pyramid Peak providing sweeping views of Lake Tahoe and its dense forests. The area is renowned for its stunning natural beauty with towering peaks and lush valleys. This section of the Pacific Crest Trail is famous for its breathtaking vistas and challenging hikes attracting both seasoned hikers and those seeking scenic experiences. The proximity to Lake Tahoe also provides unique recreational opportunities. ,83.2 km, Segment 21/50, Images/Segment21.jpg,It is a varied terrain with both forest and desert  and you will pass by a lot of large and small lakes
22,-117.2147623,33.88942411,-120.5226685,39.03072402, Northern California and Lake Tahoe,Tinker Knob lies just off the PCT and raises 2728 meters above sealevel,-120.1706,39.1441, In this segment of the Pacific Crest Trail near Lake Tahoe the path weaves through rugged terrain with scenic views of forests and mountains. Notable peaks like Granite Chief and Tinker Knob enrich the journey part of the Tahoe Rim Trail. The trail is near the towns of Truckee and Tahoe City. Truckee offers amenities and historical charm while Tahoe City provides lakeside scenery and services making them important stops for resupply and relaxation. Lake Tahoe's proximity offers additional recreational opportunities blending wilderness hiking with community access.  ,83.2 km, Segment 22/50, Images/Segment22.jpg, You will walk in Donner Memorial State Park some of the parth. The very large Lake Tahoe is close by  the closest towns to the trail are Tahoe Pines; Homewood and Rubicon Bay
23,-120.5226685,39.03072402,-118.8112043,35.36068351, Northern California through Tahoe Natianal Forest, Love Falls is just a short hike from where the trail crosses Highway 49 traveling east of the quaint village of Sierra City,-120.6071599,39.5807332, The path requires crossings over the North Yuba River and Haypress Creek which present beautiful natural water features along the way.As you cross the North Yuba River you'll also come very close to the scenic North Yuba Falls and Love Falls—two of the area's highlights. These spots are popular with hikers for their picturesque views and the soothing sounds of cascading water. The proximity to Sierra City provides a touch of civilization before returning to the secluded paths of the Tahoe National Forest making this section a blend of natural beauty and accessible amenities.,83.2 km, Segment 23/50, Images/Segment23.jpg, You walk on the egde opf Sierra city. You need to cross North Yuba River and Haypress Creek. When Crossing North Yba Falls You walk very close to Love Falls
24,-118.8112043,35.36068351,-120.2526102,41.39648189, Northern California through Plumas National Forest, Mount Fillmore is a mountain in the Plumas National Forest,-120.85339,39.73054, This section of the Pacific Crest Trail takes hikers through the rugged terrain of the Plumas National Forest. The trail meanders through dense forests mountainous vistas and remote wilderness offering a serene and challenging hiking experience. As you journey through this part of the trail you are surrounded by the natural beauty of the Northern Sierra Nevada. The trail's path is relatively isolated offering a peaceful retreat from daily life. Hikers can enjoy the solitude and rich biodiversity of the region which includes various species of trees wildflowers and wildlife. The trail also passes near the town of Quincy a convenient point for resupply before continuing the trek through the expansive wilderness areas. This segment is ideal for those looking to immerse themselves in nature and experience the quiet majesty of the Sierra Nevada's less-traveled paths., 83.2 km, Segment 24/50, Images/Segment24.jpg, This is a hilly stretch where you also have to cross the Middle Fork Feather River
25,-120.2526102,41.39648189,-118.6124795,35.95739742, Northern California through Bucks Lake Wilderness , Butt Mountain is an old remnant of Yana Volcano ,-121.39,40.22, If You do the hole trail you are in this segment in the middel or half to reach your desination. winds through the picturesque northern California terrain featuring the Bucks Lake Wilderness and a series of prominent peaks and landscapes such as Bald Eagle Mountain; Ben Lomond and Snow Mountain. The trail crosses paths with Highway 70 multiple times providing accessible points for entry or exit. Hikers traveling through this area will enjoy diverse landscapes including thick forests rocky outcrops at Castle Rocks and Eagle Rocks and the serene beauty of the surrounding mountains. This region is particularly known for its scenic vistas and the opportunity to observe wildlife in its natural habitat. The proximity to various natural landmarks and the trail's path through less frequented areas of the Plumas National Forest make this a tranquil yet adventurous segment of the Pacific Crest Trail. ,83.2 km, Segment 25/50 , Images/Segment25.jpg, If You do the hole trail you are in this segment in the middel or half to reach your desination. You need to cross North Fork Feather River and Yellow Creek
26,-118.6124795,35.95739742,-117.0334928,34.41036697, Northern California through Lassen Volcanic National Park, Lassen Peak is lava dome volcano in Lassen Volcanic National Park in Northern California.,-121.504966,40.48816,The trail navigates through a diverse geological landscape highlighted by volcanic features and mountainous terrain. You wil from the rute see Lassen Peak one of the largest plug dome volcanoes in the world offering a unique backdrop and a prime example of volcanic activity. The trail also skirts around other notable volcanic features such as Brokeoff Mountain and Mount Harkness enhancing the trek with educational opportunities and stunning views. The path winds through areas lush with mixed forests; mountain streams and meadows providing varied ecosystem and the chance to see diverse wildlife. With the vulcanic landmarks and natural beauty this wil en rich the experice of the hike combined with phycical challenges. , 83.2 km, Segment 26/50 , Images/Segment26.jpg,You will here walk in Lassen Volcanic National Park. You walk between different Mountans and Peaks. This is a parth with various elevation
27,-117.0334928,34.41036697,-121.5109129,40.78390028,Northern California & Burney, Pit River Falls is so named because of the semi-subterranean permanent winter homes and large 'sweat houses' that the Pit River Tribe dug,-122.2214,40.4523, The trail provides hikers with a mixture of landscapes that include rolling hills - dense forests and expansive meadows with the river crossing adding a dynamic element to the journey. As the trail approaches and crosses the Pit River hikers are treated to stunning river views and the chance to experience one of Northern California's important waterways. The river area is a refreshing contrast to the surrounding dry and rugged terrain and offers a unique natural habitat teeming with wildlife. The trail also passes near Burney Mountain providing dramatic views and a challenging hiking experience. The proximity to Burney allows for convenient resupply opportunities before continuing the trek through the serene and less traveled paths of the region. , 83.2 km, Segment 27/50, Images/Segment27.jpg, You will cross Pit River and come close to Burney Falls; which is 25 meter and defenitly a visit worth. Here You can find campsites and Rental Cabins
